{"behavioral_policy_identity":"sha256:ba7308cee1889a8059c2bc5fd110a9cb93f33d6d83e697dd15b5ac9bea8ab82f","contract_version":"radjax_tome_artifact_contract@3.0.0","ordered_record_sequence_digest":"sha256:948bee9e86a66ba0b41186d5c6c36cf20d6c888810fbc48a4d02ae453af0e982","record_count":4,"schema_version":"radjax_tome_semantic_identity_v3","semantic_authority_identity":"sha256:bfe7a5d58c0fe32d7f2b233381e8e863ea5bf0432ca2f813ac44e7c23113cc2b","semantic_profile_id":"selected_exemplar_semantic_profile_v3","semantic_root":"sha256:f4b765aa0ca3dcd2e551d431e239e7504c5c34ef22c50d9766544a73de934ce2"}